{
  "schema_version": 1,
  "host_id": "lab-global-primary",
  "backup_kind": "snapshot",
  "expected": true,
  "last_success_at": null,
  "snapshot_ref": null,
  "coverage_ref": "evidence/backup-coverage-1",
  "last_check_at": "2026-09-10T00:00:00Z",
  "last_restore_test_at": null,
  "error": {"code": "result_unknown", "message": "restore evidence is not available", "details": {"reason": "blocked"}}
}
